https://detail.tmall.com/item.htm?id=600333098005,小椅子实木凳子矮墩板凳儿童靠背换鞋沙发成人子孙家用客厅茶几凳,ID：600333098005,¥ 285.20,528,1,2019-08-06 17:20
https://detail.tmall.com/item.htm?id=604445658523,简易儿童衣柜卡通经济型简约现代小孩衣柜收纳婴儿宝宝衣橱组装,ID：604445658523,¥ 94.00,208988,0,2019-09-29 21:42
https://detail.tmall.com/item.htm?id=604224981749,厨房置物架落地多层收纳家用简约省空间多功能橱柜碗柜餐边柜层架,ID：604224981749,¥ 331.80,7965,0,2019-09-29 19:55
https://detail.tmall.com/item.htm?id=595718973276,店铺方桌角柜小木桌仿木接待室客厅边角几角落桌家用宾馆茶几,ID:595718973276 编码:03,¥ 62.94,170912,8,2019-06-01 10:27
https://detail.tmall.com/item.htm?id=605887072287,楠竹高餐边柜储物复古多功能厨房置物架玄关柜餐厅实木收纳茶水碗,ID:605887072287 编码:190614,¥ 186.00,2855,0,2019-10-20 18:51
https://detail.tmall.com/item.htm?id=604431610614,客厅家具方几现代简约小户型创意0.8/1/1.2米桌包邮 钢化玻璃茶几,ID：604431610614,¥ 459.90,19668,0,2019-09-29 16:28
https://detail.tmall.com/item.htm?id=600562557156,简易书桌上学生书架儿童桌面小型置物架家用收纳办公室书柜整理架,ID：600562557156,¥ 170.00,14511,3,2019-08-12 18:48
https://detail.tmall.com/item.htm?id=588369292488,简易衣柜组装仿实木人造板家用挂储物卧室租房布衣橱收纳大小柜子,ID:588369292488 编码:222222,¥ 312.00,216804,1,2019-03-09 21:47
https://detail.tmall.com/item.htm?id=604652939531,鞋架子宿舍多层简易门口置物架经济型家用省空间收纳组装防尘鞋柜,ID：604652939531,¥ 96.00,36847,0,2019-09-29 21:42
https://detail.tmall.com/item.htm?id=602835219865,穿衣镜壁挂镜子全身粘贴试衣镜贴墙镜子舞蹈镜宿舍拼接镜化妆镜子,ID：602835219865,¥ 10.50,147459,6,2019-09-10 19:03
https://detail.tmall.com/item.htm?id=588884035412,实木床头柜经济型简约现代迷你带锁小柜子卧室床边收纳储物柜整装,ID:588884035412 编码:13,¥ 300.00,54101,12,2019-03-09 20:34
https://detail.tmall.com/item.htm?id=590595396792,简易实木双人床主卧1.8米现代简约1.5米出租房床1.2经济型单人床,ID:590595396792 编码:Cg-004,¥ 300.00,1413966,1,2019-04-03 17:57
https://detail.tmall.com/item.htm?id=594020901292,北欧小吧台桌家用隔断柜现代简约实木创意吧台柜客厅酒柜吧台餐桌,ID：594020901292,¥ 200.00,130797,1,2019-05-11 15:21
https://detail.tmall.com/item.htm?id=592661697494,白色店铺卧室窗桌子小茶几可收纳家用床边双层美容院办公室矮桌,ID：592661697494,¥ 117.00,85870,2,2019-04-25 20:52
https://detail.tmall.com/item.htm?id=590751500475,木板床垫硬板经济型实木成人加宽学生宿舍单折叠1.5拼接架子护腰,ID:590751500475 编码:002,¥ 211.26,1417,3,2019-04-05 12:55
https://detail.tmall.com/item.htm?id=603984144077,美式乡村复古实木花架几阶梯落地式多层方形置物架子阳台花台美式,ID：603984144077,¥ 115.50,231,0,2019-09-29 21:51
https://detail.tmall.com/item.htm?id=588585533981,天然椰棕榈床垫家用3e棕垫可定制三折叠加厚学生儿童经济型偏硬垫,ID:588585533981 编码:20170628006,¥ 160.00,43656,6,2019-03-09 22:19
https://detail.tmall.com/item.htm?id=593824341378,墙角装饰木板材料转角打孔扇形隔板墙上置物架拐墙角免三角层板角,ID:593824341378 编码:9999,¥ 34.28,37727,15,2019-05-09 13:18
https://detail.tmall.com/item.htm?id=589640004655,儿童床带护栏男孩女孩公主床加宽拼接铁床组合小床单人床边床粉色,ID:589640004655 编码:HLB,¥ 496.00,1935,2,2019-03-24 15:47
https://detail.tmall.com/item.htm?id=591314403719,的布拉链式收纳架烘干不锈钢装家用布罩外简易衣柜韩式挂+一次性,ID:591314403719 编码:GDSM1,¥ 216.20,75409,3,2019-04-05 17:29
https://detail.tmall.com/item.htm?id=602833791698,简易课桌折叠桌培训桌 电脑桌补习桌快餐桌折叠简约桌子补习桌,ID：602833791698,¥ 51.98,154472,6,2019-09-10 18:28
https://detail.tmall.com/item.htm?id=589898500000,沙发床两用折叠多功能单人小户型布艺皮质出租房发廊1.8*0.95沙发,ID：589898500000,¥ 468.48,14371,5,2019-03-21 19:02
https://detail.tmall.com/item.htm?id=590074550255,欧式衣帽间北欧木架衣柜 简易 组装 实木 家用牛津布儿童卡通分隔,ID：590074550255,¥ 119.80,33534,13,2019-03-25 11:46
https://detail.tmall.com/item.htm?id=589609643106,中式床头靠背板实木单人1.8现代简约双人1.5榻榻米床头板经济型,ID:589609643106 编码:+1,¥ 93.99,10838,3,2019-03-18 19:54
https://detail.tmall.com/item.htm?id=588726702773,简易衣柜钢管加粗加固布衣柜布艺简约现代经济型组装衣橱收纳柜子,ID：588726702773,¥ 298.00,6632,33,2019-03-09 21:53
https://detail.tmall.com/item.htm?id=593501804541,简易床出租房专用 双人 经济型樟子松实木床1.35米一米二床单人床,ID:593501804541 编码:01,¥ 528.68,374680,2,2019-05-08 12:03
https://detail.tmall.com/item.htm?id=600954415719,楠竹可移动小书架落地省空间带滑轮简易宿舍多功能实木置物架23cm,ID：600954415719,¥ 152.00,1867,1,2019-08-12 19:44
https://detail.tmall.com/item.htm?id=606576451028,实木榻榻米床松木单人双人床1.2米1.5实木床1.8米无床头简易床架,ID:606576451028 编码:实木床,¥ 174.80,24508,0,2019-10-20 19:37
https://detail.tmall.com/item.htm?id=596090081178,多功能童鞋单排拼装家用简易鞋柜鞋架开放式组合多层北欧风家具黑,ID：596090081178,¥ 152.68,5627,17,2019-06-06 16:08
https://detail.tmall.com/item.htm?id=605888208939,实木床1.8米现代简约1.5米双人床主卧大床出租房简易1.2米单人床,ID:605888208939 编码:HJ-01,¥ 1400.00,3138,0,2019-10-20 19:34
https://detail.tmall.com/item.htm?id=603339383645,进门鞋柜玄关柜木质多层带门反斗经济型家用门口入户17cm超薄翻斗,ID：603339383645,¥ 352.80,2072,0,2019-09-18 17:02
https://detail.tmall.com/item.htm?id=602257113689,简易衣柜实木简易布衣柜收纳柜子布艺组装单人衣橱简约现代经济型,ID：602257113689,¥ 117.60,9288,0,2019-09-07 20:45
https://detail.tmall.com/item.htm?id=597462957647,家用双层鞋子收纳架塑料一体式鞋托简约现代客厅衣柜简易收纳鞋架,ID:597462957647 编码:596772176267,¥ 4.86,999925,47,2019-06-28 10:11
https://detail.tmall.com/item.htm?id=603142966513,飘窗桌子创意多功能笔记本桌面萤幕电脑显示器增高架可调节可升降,ID：603142966513,¥ 478.80,2579,0,2019-09-18 17:27
https://detail.tmall.com/item.htm?id=602926937380,阳台榻榻米小茶几配沙发办公室会客区简约小租房极简轻奢矮桌子,ID：602926937380,¥ 176.40,2236,1,2019-09-18 16:44
https://detail.tmall.com/item.htm?id=603983764088,简易衣柜简约现代组装折叠布衣橱防尘加固加粗收纳柜经济型省空间,ID：603983764088,¥ 106.00,11906,0,2019-09-29 21:42
https://detail.tmall.com/item.htm?id=604568779085,实木收纳柜化妆品桌面抽屉多层置物架办公室书桌储物盒卧室首饰盒,ID：604568779085,¥ 194.67,39771,0,2019-09-28 10:59
https://detail.tmall.com/item.htm?id=602464350833,儿童书桌塑料桌椅学习桌套装幼儿园小孩宝宝课桌写字桌台1桌1椅套,ID：602464350833,¥ 287.70,115662,2,2019-09-07 20:44
https://detail.tmall.com/item.htm?id=600189216482,实木茶桌椅组合家用可移动小茶台阳台茶几茶具套装烧水壶桌子一体,ID：600189216482,¥ 1040.00,11450,0,2019-08-10 17:32
https://detail.tmall.com/item.htm?id=606100511893,衣柜现代简约经济型出租房用木质衣橱整体组装板式四五门卧室衣柜,ID:606100511893 编码:2813,¥ 1638.00,303,0,2019-10-15 19:53
https://detail.tmall.com/item.htm?id=602641770611,鞋架简易门外家用门口迷你小号鞋柜经济型省空间进门客厅室外放的,ID：602641770611,¥ 34.17,15152,3,2019-09-10 19:47
https://detail.tmall.com/item.htm?id=594094003184,活动衣柜 组装 简约现代 便捷式厨子易卧室小帆布钢管加厚成人,ID:594094003184 编码:75 90 113,¥ 254.80,21788,2,2019-05-08 17:06
https://detail.tmall.com/item.htm?id=604436626768,移动小茶几带轮茶桌边柜泡茶车实木家用烧水壶茶台茶水架置物架子,ID：604436626768,¥ 189.00,2094,0,2019-09-29 18:04
https://detail.tmall.com/item.htm?id=602683768546,出租屋改造小桌子落地宿舍卧室女生少女收纳书桌书架组合小户型,ID：602683768546,¥ 373.80,1504,0,2019-09-18 16:09
https://detail.tmall.com/item.htm?id=602935865125,小桌子简约租房置物台式电脑桌经济型书桌家用大人书房卧室办公桌,ID：602935865125,¥ 247.80,532,1,2019-09-18 19:32
https://detail.tmall.com/item.htm?id=600766610663,儿童书架实木简约落地收纳矮柜子学生置物架省空间格子书柜经济型,ID：600766610663,¥ 398.00,47611,2,2019-08-12 19:59
https://detail.tmall.com/item.htm?id=602832907638,墙上置物架壁挂书架卧室隔板墙面吊柜客厅电视背景墙壁柜创意酒架,ID：602832907638,¥ 81.90,1099691,0,2019-09-10 18:07
https://detail.tmall.com/item.htm?id=602256297397,北欧日式榻榻米床定制实木床现代简约矮床无床头床租房经济型床架,ID：602256297397,¥ 907.20,14719,0,2019-09-07 20:22
https://detail.tmall.com/item.htm?id=603144906008,网红置物架落地置物书柜展示架房间客厅飘窗小摆件ins极简书架,ID：603144906008,¥ 270.90,6195,2,2019-09-18 17:59
https://detail.tmall.com/item.htm?id=600191752681,儿童房洞洞板墙上置物架桌面收纳架免打孔照片墙卧室北欧墙面装,ID：600191752681,¥ 442.32,218,1,2019-08-10 18:14
https://detail.tmall.com/item.htm?id=603981000326,北欧小创意凳子沙发凳客厅板凳家用方凳矮凳布艺试衣间换鞋凳脚踏,ID：603981000326,¥ 340.20,4607,0,2019-09-29 20:36
https://detail.tmall.com/item.htm?id=602834775772,幼儿园板凳塑料椅子靠背桌椅家用小孩座椅儿童防滑凳子宝宝小椅子,ID：602834775772,¥ 34.65,39507,1,2019-09-10 18:51
https://detail.tmall.com/item.htm?id=603981072199,简易鞋架子门口放家用经济型宿舍多层防尘收纳神器实木欧式小鞋柜,ID：603981072199,¥ 134.40,15712,0,2019-09-29 20:35
https://detail.tmall.com/item.htm?id=603148854095,桌面收纳组合简易钢木放书架多功能北欧多层学生电脑台式桌置物架,ID：603148854095,¥ 203.70,1526,1,2019-09-18 19:22
https://detail.tmall.com/item.htm?id=603974584776,折叠书桌台式电脑桌实木家用学生学习写字桌椅办公桌笔记本小桌子,ID：603974584776,¥ 105.00,9144,0,2019-09-29 18:04
https://detail.tmall.com/item.htm?id=590942450757,麻将桌面象棋桌面双面用桌板折叠收纳桌面餐桌面板台尼麻将桌面,ID:590942450757 编码:003,¥ 153.40,551,2,2019-04-03 14:07
https://detail.tmall.com/item.htm?id=602189940861,包邮简易折叠桌长方形培训桌摆摊桌户外学习书桌会议长条桌餐桌,ID：602189940861,¥ 38.43,2751232,3,2019-09-10 19:16
https://detail.tmall.com/item.htm?id=604229125936,北欧田园超薄翻斗鞋柜简约现代门厅玄关柜门口家用进门衣架鞋架,ID：604229125936,¥ 240.00,2736,0,2019-09-29 21:42
https://detail.tmall.com/item.htm?id=603983612709,电脑台式桌家用经济型钢木书桌简约办公桌子包邮单人桌双人电脑桌,ID：603983612709,¥ 141.12,97195,0,2019-09-29 21:51
https://detail.tmall.com/item.htm?id=588819665895,折叠凳户外旅游地铁板凳小马扎折叠便携式迷你超轻折叠凳椅子,ID:588819665895 编码:1,¥ 39.60,5090,33,2019-03-12 23:55
https://detail.tmall.com/item.htm?id=597380286432,可折叠式小凳子便携带火车旅游椅子迷你收缩板凳随身户外轻小马扎,ID:597380286432 编码:591631495192,¥ 33.60,3570,5,2019-06-24 18:06
https://detail.tmall.com/item.htm?id=598764529419,卫生间洗脚小板凳洗衣服坐的小板凳卫生间洗脚小凳子防滑家用凳子,ID：598764529419,¥ 21.32,884506,2,2019-07-17 22:20
https://detail.tmall.com/item.htm?id=604354108531,镂空收纳架书架简易理发店置物架卧室墙角小型家用铁学生客厅落地,ID：604354108531,¥ 101.30,3103388,0,2019-10-03 16:25
https://detail.tmall.com/item.htm?id=602655327892,电脑显示器增高架桌面书架格架键盘收纳架桌上置物架隔板底座支架,ID：602655327892,¥ 29.84,21021,7,2019-09-07 20:00
https://detail.tmall.com/item.htm?id=602464014055,北欧单人沙发椅迷你布艺现代简约懒人休闲阳台卧室小户型双人沙发,ID：602464014055,¥ 331.80,22456,1,2019-09-07 20:23
https://detail.tmall.com/item.htm?id=602854078114,电脑桌长条办公桌子长方形靠墙书桌简约家用窄桌简易写字台学习桌,ID：602854078114,¥ 163.80,209884,0,2019-09-14 14:19
https://detail.tmall.com/item.htm?id=603983796482,花架子实木落地阶梯家用阳台客厅多层创意花架室内绿萝花盆置物架,ID：603983796482,¥ 115.50,13180,0,2019-09-29 21:51
https://detail.tmall.com/item.htm?id=600751246306,牛角椅小吃甜品店奶茶店休闲咖啡厅音乐餐吧烧烤餐饮快餐桌椅组合,ID：600751246306,¥ 141.90,3264,0,2019-08-12 16:01
https://detail.tmall.com/item.htm?id=602432345135,好尔加厚马桶凳子垫脚凳塑料儿童脚踏凳成人蹲坑蹲便登厕所坐便凳,ID：602432345135,¥ 39.06,76349,1,2019-09-10 18:52
https://detail.tmall.com/item.htm?id=604652867635,简易边桌简约日式实木圆桌子小户型北欧茶几ins风床头桌沙发边几,ID：604652867635,¥ 170.00,90428,0,2019-09-29 21:42
https://detail.tmall.com/item.htm?id=604650067739,简易衣柜单人租房布衣柜实木组装牛津布布艺挂衣柜简约现代经济型,ID：604650067739,¥ 96.60,20971,0,2019-09-29 20:34
https://detail.tmall.com/item.htm?id=602924365437,出租屋改造小桌子租房用的电脑台式桌单人家用简易书桌书架组合,ID：602924365437,¥ 268.80,5192,1,2019-09-18 15:57
https://detail.tmall.com/item.htm?id=602688097748,宿舍70收纳50家用对开门仿实木省空间有门宽60厘米门口鞋柜组装,ID：602688097748,¥ 207.27,41676,1,2019-09-15 11:15
https://detail.tmall.com/item.htm?id=597102210939,休闲茶几圆形茶几桌小台子钢化玻璃边几沙发桌藤艺编织桌子阳台桌,ID：597102210939,¥ 116.00,2858,16,2019-06-20 19:43
https://detail.tmall.com/item.htm?id=602014136034,【两边带拉链】雅锐凡多层组合鞋架防尘简易布鞋柜组装收纳置物架,ID：602014136034,¥ 41.79,8901,1,2019-09-07 20:42
https://detail.tmall.com/item.htm?id=604653263552,北欧花架现代简约客厅装饰架室内置物架实木铁艺落地绿萝吊兰花架,ID：604653263552,¥ 210.00,999999,0,2019-09-29 21:51
https://detail.tmall.com/item.htm?id=602636734733,墙壁折叠桌餐桌壁挂桌挂墙电脑桌厨房桌饭桌学习桌书桌快餐店墙桌,ID：602636734733,¥ 189.00,21952,1,2019-09-10 17:52
https://detail.tmall.com/item.htm?id=602256417228,茶几桌客厅桌子简约现代创意ins沙发边几桌卧室阳台小户型小茶几,ID：602256417228,¥ 161.70,89908,0,2019-09-07 20:21
https://detail.tmall.com/item.htm?id=605885888137,欧式床头柜简约现代储物柜迷你收纳柜卧室床边柜实木北欧客厅边柜,ID:605885888137 编码:001,¥ 296.00,4704,0,2019-10-20 18:22
https://detail.tmall.com/item.htm?id=603983544394,懒人沙发豆袋榻榻米网红款卧室少女心可爱单人椅子地垫小户型躺椅,ID：603983544394,¥ 136.00,209115,0,2019-09-29 21:42
https://detail.tmall.com/item.htm?id=602190484927,花架铁艺多层客厅绿萝阳台多肉花盆架装饰室内落地省空间花架子,ID：602190484927,¥ 79.80,78983,0,2019-09-10 19:29
https://detail.tmall.com/item.htm?id=604353824998,雨伞架铁艺家用创意伞桶北欧多功能门口个性时尚教室放简易简约筒,ID：604353824998,¥ 136.50,5542,0,2019-10-03 16:29
https://detail.tmall.com/item.htm?id=598283945721,包邮家用雨伞架长柄短柄雨伞通用收纳架子办公室带接水盘伞具收纳,ID：598283945721,¥ 77.97,413,6,2019-07-10 22:05
https://detail.tmall.com/item.htm?id=602433857511,铁艺带挂钩办公桌三角花架置物架办公室收纳挂架桌面架阳台转角架,ID：602433857511,¥ 31.50,3454,1,2019-09-10 19:35
https://detail.tmall.com/item.htm?id=602434913161,鞋架宿舍大学生床底寝室简易防尘迷你鞋柜鞋子收纳神器小型省空间,ID：602434913161,¥ 39.90,5558,15,2019-09-10 19:58
https://detail.tmall.com/item.htm?id=598660251481,纳艾森 带锁小柜子带门储物柜单个 迷你家用实木收纳柜桌面储物箱,ID：598660251481,¥ 230.51,3615,1,2019-07-10 22:02
https://detail.tmall.com/item.htm?id=600955587278,放茶杯的小柜子放客厅收纳家用沙发边柜储物柜床头柜客厅窄高,ID：600955587278,¥ 89.58,998,11,2019-08-12 20:04
https://detail.tmall.com/item.htm?id=602180832831,实木台阶多肉花架多层阳台阶梯防腐木质花架子盆栽花盆架鱼缸底座,ID：602180832831,¥ 21.00,4953566,2,2019-09-10 16:10
https://detail.tmall.com/item.htm?id=603144158855,家用客厅靠墙柜子储物柜出租屋碗柜简易出租房收纳柜小户型餐边柜,ID：603144158855,¥ 499.80,2585,0,2019-09-18 17:56
https://detail.tmall.com/item.htm?id=603340991847,椅子ins网红沙发凳小板凳结实加厚小凳子家用大人矮款布艺茶几凳,ID：603340991847,¥ 96.60,4529,0,2019-09-18 17:30
https://detail.tmall.com/item.htm?id=602464354827,北欧鞋柜家用门口大容量简约现代多功能鞋架简易实木色收纳玄关柜,ID：602464354827,¥ 239.40,30095,1,2019-09-07 20:44
https://detail.tmall.com/item.htm?id=604442734943,塑料凳子家用加厚塑料凳高凳板凳朔料登子吃饭用客厅熟胶椅子胶凳,ID：604442734943,¥ 115.50,84872,0,2019-09-29 20:34
https://detail.tmall.com/item.htm?id=600635578115,90/60cm欧式鞋柜宽30门口小鞋柜墙角多层鞋架防尘多功能储物收纳,ID：600635578115,¥ 276.00,4433,1,2019-08-10 21:20
https://detail.tmall.com/item.htm?id=603139006744,女生网红房间布置小桌子卧室少女小型创意ins阳台简约租房小茶几,ID：603139006744,¥ 184.80,6593,0,2019-09-18 16:25
https://detail.tmall.com/item.htm?id=606571735316,上下铺木床大人成年高低床全实木子母床宿舍床儿童床上下床双层床,ID:606571735316 编码:2213,¥ 1058.40,27855,0,2019-10-20 17:47
https://detail.tmall.com/item.htm?id=595977856667,鞋架简易多层家用经济型防尘宿舍门口小鞋架子收纳组装鞋柜省空间,ID：595977856667,¥ 45.08,115773,1,2019-06-08 17:55
https://detail.tmall.com/item.htm?id=603140566496,出租屋改造小家具桌子简约租房置物简易书桌台式电脑桌加书架组合,ID：603140566496,¥ 373.80,516,0,2019-09-18 16:47
https://detail.tmall.com/item.htm?id=604226421723,实木衣架欧式白色卧室落地衣帽挂衣架简约门厅置物架家用衣服挂架,ID：604226421723,¥ 312.90,9003,0,2019-09-29 20:33
https://detail.tmall.com/item.htm?id=602631478748,小凳子布艺圆凳时尚坐墩实木板凳创意矮凳儿童家用换鞋客厅沙发凳,ID：602631478748,¥ 27.09,40458,1,2019-09-10 16:10
https://detail.tmall.com/item.htm?id=602255653148,衣柜简易布衣柜宿舍组装柜子现代简约卧室家用经济型挂衣柜出租房,ID：602255653148,¥ 226.80,3505,0,2019-09-07 20:00
https://detail.tmall.com/item.htm?id=604353232568,电脑椅办公室椅子职员椅学生家用经济型单人休闲靠背舒适办公椅,ID：604353232568,¥ 197.32,197106,0,2019-10-03 16:18
https://detail.tmall.com/item.htm?id=603147950800,小桌子阳台小型创意女生卧室坐地ins少女客厅迷你茶几小户型超窄,ID：603147950800,¥ 184.80,5739,1,2019-09-18 19:15
https://detail.tmall.com/item.htm?id=601558217353,大学生宿舍床上书桌寝室上铺下铺带锁小桌子简易飘窗笔记本电脑桌,ID：601558217353,¥ 198.00,5972,2,2019-08-27 14:28
https://detail.tmall.com/item.htm?id=603335319294,小户型现代简约客厅置物架房间卧室主卧单个简易电视柜极简家具,ID：603335319294,¥ 256.00,2276,1,2019-09-18 15:51
https://detail.tmall.com/item.htm?id=602641529962,34cm白色小书架落地简易窄小型省空间墙角置物架卧室转角飘窗书柜,ID：602641529962,¥ 186.90,7471,1,2019-09-14 13:51
https://detail.tmall.com/item.htm?id=596924673018,定制实木洞洞板货架墙上置物架衣帽架厨房客厅壁挂展木板收纳架,ID：596924673018,¥ 24.00,20507,3,2019-06-20 19:46
https://detail.tmall.com/item.htm?id=606573079987,实木雕花床头柜简约现代中式整装边角储物柜床边收纳柜胡桃海棠色,ID:606573079987 编码:016#,¥ 552.00,1320,0,2019-10-20 18:30
https://detail.tmall.com/item.htm?id=605896414405,简约现代小型迷你床头柜北欧白色ins风超窄款40\30\20\35\45cm宽,ID:605896414405 编码:5528,¥ 353.43,605,0,2019-10-15 22:42
https://detail.tmall.com/item.htm?id=602931613910,置物架落地ins风创意艺术窗台上的书架经济型家用客厅儿童收纳架,ID：602931613910,¥ 144.90,2561,0,2019-09-18 18:15
https://detail.tmall.com/item.htm?id=604644283489,楠竹小茶几桌边几角柜泡茶水架置物架实木客厅饮水机架烧水壶架子,ID：604644283489,¥ 151.20,35695,0,2019-09-29 18:03
https://detail.tmall.com/item.htm?id=604650427338,躺椅折叠午休阳台靠背午睡椅休闲家用便携沙滩老懒人办公室凉椅子,ID：604650427338,¥ 501.90,11498,0,2019-09-29 20:33
https://detail.tmall.com/item.htm?id=602255549247,衣柜简易布艺双人简约现代经济型衣橱折叠单人组装学生宿舍布衣柜,ID：602255549247,¥ 60.90,15526,0,2019-09-07 20:00
https://detail.tmall.com/item.htm?id=600805791302,折叠桌餐桌小户型家用厨房省空间操作台隐形壁挂墙上简易吃饭桌子,ID：600805791302,¥ 440.00,368,0,2019-08-10 16:07
https://detail.tmall.com/item.htm?id=602687969731,超溥鞋柜20cm超薄网红鞋柜家用收纳神器省空间卧室鞋柜小户型,ID：602687969731,¥ 573.30,1267,0,2019-09-15 11:13
https://detail.tmall.com/item.htm?id=601262493889,北欧现代简约塑料椅子家用懒人休闲创意牛角椅靠背咖啡厅餐厅桌椅,ID：601262493889,¥ 150.00,8848,0,2019-08-23 11:02
https://detail.tmall.com/item.htm?id=603137282196,学生书桌椅舒适久坐女生可爱卧室看书舒服的靠背网红椅子抖音同款,ID：603137282196,¥ 298.00,2271,1,2019-09-18 15:51
https://detail.tmall.com/item.htm?id=603980852495,简易实木落地衣帽架客厅卧室简约挂衣架家用衣服架子创意收纳衣架,ID：603980852495,¥ 123.90,4178,0,2019-09-29 20:34
https://detail.tmall.com/item.htm?id=600428517355,北欧ins卧室床头柜简约现代创意小户型沙发边角柜网红收纳置物架,ID：600428517355,¥ 304.64,663,1,2019-08-10 19:07
https://detail.tmall.com/item.htm?id=606363570346,儿童拼接加宽实木延边床简约经济环保型松木简易单人床定制包邮,ID:606363570346 编码:520002,¥ 290.00,7452,0,2019-10-20 19:38
https://detail.tmall.com/item.htm?id=604819670878,书架置物架落地儿童简易书柜子桌上学生小书架客厅书桌面简约实木,ID：604819670878,¥ 329.70,6050,0,2019-10-03 16:27
https://detail.tmall.com/item.htm?id=595942073571,欧式沙发美容院接待小户型组合双人三人客厅布艺服装店办公沙发椅,ID:595942073571 编码:m-043,¥ 776.40,18908,0,2019-06-04 15:27
https://detail.tmall.com/item.htm?id=604445322911,卡通婴幼儿学坐儿童小沙发宝宝沙发椅幼儿园座椅榻榻米防摔可拆洗,ID：604445322911,¥ 119.94,19538,0,2019-09-29 21:42
https://detail.tmall.com/item.htm?id=603983740571,小户型壁挂电视柜挂墙客厅背景墙装饰卧室机顶盒墙上置物架悬挂式,ID：603983740571,¥ 394.80,8854,0,2019-09-29 21:51
https://detail.tmall.com/item.htm?id=602447052138,进门鞋柜家用门口经济型大容量酒柜屏风鞋柜一体靠墙木质多层带门,ID：602447052138,¥ 262.50,107873,1,2019-09-15 11:17
https://detail.tmall.com/item.htm?id=606364274482,实木胡桃木儿童床拼接大床婴儿带护栏加宽边床定做男女孩单人小床,ID:606364274482 编码:A558,¥ 1280.00,10628,1,2019-10-20 19:57
https://detail.tmall.com/item.htm?id=602924221105,网红房间布置小桌子阳台小型创意飘窗小圆桌矮脚卧室坐地ins茶几,ID：602924221105,¥ 238.00,2278,1,2019-09-18 15:51
https://detail.tmall.com/item.htm?id=602935573416,简易书架落地儿童简约收纳书柜经济型小置物架学生家用省空间书橱,ID：602935573416,¥ 94.50,68931,0,2019-09-18 19:30
https://detail.tmall.com/item.htm?id=602445552532,北欧餐边柜靠墙柜子储物柜家用长80 90cm100宽30高木厨房碗柜客厅,ID：602445552532,¥ 205.80,704,1,2019-09-15 10:52
https://detail.tmall.com/item.htm?id=602694720411,书桌书架组合小户型写字桌子租房用的经济型中学生初中生家用简约,ID：602694720411,¥ 237.30,5743,0,2019-09-18 19:29
https://detail.tmall.com/item.htm?id=602657691149,区域围栏藤编儿童隔断装饰栏隔墙折屏幼儿园专用小屏风 可定尺寸,ID：602657691149,¥ 14.70,100064,19,2019-09-07 20:42
https://detail.tmall.com/item.htm?id=602636358744,定制饭店餐厅长方形面馆桌子甜品店小吃店奶茶餐饮店快餐桌椅组合,ID：602636358744,¥ 210.00,106578,1,2019-09-10 17:44
https://detail.tmall.com/item.htm?id=602657147893,欧式实木衣帽架卧室家用室内挂衣架落地酒店衣挂架办公室挂衣架架,ID：602657147893,¥ 138.60,19964,0,2019-09-07 20:42
https://detail.tmall.com/item.htm?id=603144682880,桌子女生卧室梳妆台小型60cm经济型少女收纳租房简约出租屋化妆桌,ID：603144682880,¥ 315.00,6845,0,2019-09-18 18:03
