https://detail.tmall.com/item.htm?id=605892906115,欧式实木床白色现代简约1.5米1.8米双人床美式婚床高箱储物公主床,ID:605892906115 编码:1623,¥ 2856.00,209616,0,2019-10-15 21:37
https://detail.tmall.com/item.htm?id=602837675286,情侣餐桌椅组合，小户型餐桌椅，双人餐桌一桌两椅，厨房简易桌椅,ID：602837675286,¥ 283.50,2458,0,2019-09-10 19:55
https://detail.tmall.com/item.htm?id=600093986667,桌面置物架电脑书桌上书架铁艺多层宿舍学生多功能简易小型收纳架,ID：600093986667,¥ 190.90,21940,1,2019-08-03 11:13
https://detail.tmall.com/item.htm?id=602434393903,简约北欧休闲椅塑料牛角椅靠背椅家用彩色餐椅冷饮咖啡餐厅椅,ID：602434393903,¥ 121.80,100467,1,2019-09-10 19:58
https://detail.tmall.com/item.htm?id=606571863109,寝室凳子宿舍 大学生靠背 懒人座椅文艺上铺床上软椅子简易柔,ID:606571863109 编码:见描述,¥ 97.55,48385,0,2019-10-20 17:47
https://detail.tmall.com/item.htm?id=606572071569,简约现代布艺储物高箱床羽绒靠包全实木框架可拆洗1.8北欧布艺床,ID:606572071569 编码:808#,¥ 5418.00,813,0,2019-10-20 18:00
https://detail.tmall.com/item.htm?id=602837499083,塑料凳子家用成人加厚胶凳经济型客厅椅子板凳餐桌凳简易大号高凳,ID：602837499083,¥ 23.73,47515,4,2019-09-10 19:46
https://detail.tmall.com/item.htm?id=605028131042,儿童学习书桌加厚写字桌椅套装5-6-8-9-10-12-15岁中小学生一年级,ID：605028131042,¥ 495.60,6558,0,2019-10-03 16:23
https://detail.tmall.com/item.htm?id=600946659836,简易书架实木多层收纳置物现代简约阳台落地儿童储物架上学书柜,ID：600946659836,¥ 316.00,9582,1,2019-08-12 17:49
https://detail.tmall.com/item.htm?id=603345787169,黑白色调电脑椅家用舒适久坐游戏电竞椅办公室可躺人体工程学椅子,ID：603345787169,¥ 585.90,770,0,2019-09-18 18:52
https://detail.tmall.com/item.htm?id=603145858721,梳妆台收纳柜一体桌子女生卧室小型少女北欧网红抖音出租屋化妆桌,ID：603145858721,¥ 709.80,1427,0,2019-09-18 18:28
https://detail.tmall.com/item.htm?id=604650247526,欧式铁艺花架家用多层落地式置物架客厅绿萝花架室内吊兰花盆架子,ID：604650247526,¥ 62.79,1287,0,2019-09-29 20:34
https://detail.tmall.com/item.htm?id=602184164987,笔记本电脑桌床上书桌实木折叠桌懒人桌可携带小桌子学生寝室书桌,ID：602184164987,¥ 60.48,470,1,2019-09-10 17:13
https://detail.tmall.com/item.htm?id=604145793103,实木桌面双门收纳盒置物架学生书架书橱柜化妆品抽屉式整理盒简约,ID：604145793103,¥ 193.20,19919,0,2019-09-28 10:58
https://detail.tmall.com/item.htm?id=602642306391,灶台柜燃气灶架子气瓶柜橱柜简易组装经济型厨房柜子,ID:602642306391 编码:煤气罐专用柜,¥ 270.48,1721,0,2019-09-10 19:57
https://detail.tmall.com/item.htm?id=602434273949,飘窗电脑桌卧室阳台桌窗台家用学习写字弧形转角书桌茶几端景台吧,ID：602434273949,¥ 189.00,17605,1,2019-09-10 19:55
https://detail.tmall.com/item.htm?id=604443298286,儿童学习桌椅套装作业桌宝宝幼儿园学生书台桌小孩简约写字桌椅子,ID：604443298286,¥ 186.90,61037,0,2019-09-29 20:36
https://detail.tmall.com/item.htm?id=602933785604,寝室床边桌出租房小桌子简易家用沙发旁边可移动懒人笔记本电脑桌,ID：602933785604,¥ 163.80,1692,1,2019-09-18 18:58
https://detail.tmall.com/item.htm?id=605888576859,折叠床单人床1.2米简易床儿童午休床成人双人家用实木板式床小床,ID:605888576859 编码:A0003,¥ 420.00,7446,0,2019-10-20 19:41
https://detail.tmall.com/item.htm?id=602192164214,创意隔板墙上置物架壁挂墙壁书架书柜储物架壁柜吊书柜装饰格子架,ID：602192164214,¥ 95.63,18005,1,2019-09-10 19:56
https://detail.tmall.com/item.htm?id=605027555097,书架置物架落地儿童简易书柜子桌上学生小书架书桌面简约实木客厅,ID：605027555097,¥ 183.75,79064,0,2019-10-03 16:18
https://detail.tmall.com/item.htm?id=603136782782,网红房间布置小桌子阳台小型创意多功能飘窗小圆桌卧室女坐地ins,ID：603136782782,¥ 152.00,4007,0,2019-09-18 15:51
https://detail.tmall.com/item.htm?id=602013176247,初中生写字桌高中生学生书桌椅子电脑桌台式简约书架书组合学习桌,ID：602013176247,¥ 205.80,1038,1,2019-09-07 20:22
https://detail.tmall.com/item.htm?id=602687365144,书桌电脑台式桌置物架小型桌面铁艺学生ins北欧简易桌上书架收纳,ID：602687365144,¥ 163.80,4723,3,2019-09-15 10:52
https://detail.tmall.com/item.htm?id=604648367887,床头柜小桌子升降创意省空间多功能床边桌可移动经济型卧室收纳柜,ID：604648367887,¥ 310.80,3926,0,2019-09-29 19:55
https://detail.tmall.com/item.htm?id=602433189518,墙上置物架床头创意简易书架隔板墙面墙壁挂卧室背景墙体装饰一字,ID：602433189518,¥ 39.90,5729,10,2019-09-10 19:18
https://detail.tmall.com/item.htm?id=600192396088,鞋架藤编门口鞋柜实木简易鞋柜收纳柜鞋柜鞋架多层简易家用经济型,ID：600192396088,¥ 259.20,417,2,2019-08-10 18:18
https://detail.tmall.com/item.htm?id=605886312130,北欧床头柜实木简约现代卧室整装原木色迷你床边创意储物柜收纳柜,ID:605886312130 编码:03#06#09#38#,¥ 516.00,5539,0,2019-10-20 18:31
https://detail.tmall.com/item.htm?id=604820802295,客房卧室沙发办公双人床边小户型经济型情侣接待室居室门市室内商,ID：604820802295,¥ 740.19,408813,0,2019-10-03 16:31
https://detail.tmall.com/item.htm?id=604820498505,"电视柜 小户型1米 1.2 1.4主卧电视桌小型创意1.7 2米家用玻璃,",ID：604820498505,¥ 552.30,17594,0,2019-10-03 16:31
https://detail.tmall.com/item.htm?id=606575611359,佛龛神台家用经济型关公财神爷摆放台观音佛台挂式先祖供奉保家仙,ID:606575611359 编码:518,¥ 133.20,19946,0,2019-10-20 19:22
https://detail.tmall.com/item.htm?id=606572531754,落地桌子 学生宿舍 置地用 折叠户外摆摊桌写字台长方形吃饭桌学,ID:606572531754 编码:088-99,¥ 68.75,21103,0,2019-10-20 18:14
https://detail.tmall.com/item.htm?id=603146742270,网红房间布置桌子女生卧室少女梳妆台收纳柜一体出租屋改造小家具,ID：603146742270,¥ 354.90,1698,0,2019-09-18 18:38
https://detail.tmall.com/item.htm?id=605027711748,网红迷你多格子储物塑料收纳多功能空间小衣柜柜子省小型组装简易,ID：605027711748,¥ 131.67,170613,0,2019-10-03 16:29
https://detail.tmall.com/item.htm?id=604226833310,简约现代小户型可移动折叠餐桌边柜组合碗柜微波炉柜简易吃饭桌子,ID：604226833310,¥ 394.80,16830,0,2019-09-29 20:34
https://detail.tmall.com/item.htm?id=603909736309,多功能卧室电视柜现代简约主卧简欧风格高款农村平房加高储物地柜,ID：603909736309,¥ 139.94,11720,0,2019-09-28 14:37
https://detail.tmall.com/item.htm?id=603979260398,悬挂桌床边桌床上桌简约现代可移动电脑台式桌省空间小户型懒人桌,ID：603979260398,¥ 310.80,31858,0,2019-09-29 19:55
https://detail.tmall.com/item.htm?id=602657091990,欧式梳化妆凳简约现代布艺实木梳妆台椅子美甲凳子田园卧室换鞋凳,ID：602657091990,¥ 102.82,30833,0,2019-09-07 20:42
https://detail.tmall.com/item.htm?id=602898782407,北欧茶几简约小户型简易组合家用小桌子客厅创意圆形边几50长60宽,ID：602898782407,¥ 186.90,239868,0,2019-09-15 10:53
https://detail.tmall.com/item.htm?id=606364214018,全钢排骨架 铁架 折叠床架 铁架床 环保没气味婴儿床架子 床板,ID:606364214018 编码:2,¥ 608.00,15302,0,2019-10-20 19:47
https://detail.tmall.com/item.htm?id=606571287682,30公分宽柜子家用20cm卧室的小床头柜25厘米现代简约带锁迷你窄,ID:606571287682 编码:SY-ZG,¥ 89.31,9222,0,2019-10-20 17:43
https://detail.tmall.com/item.htm?id=602832831544,花架子多层室内特价实木质桌面窗台置物家用多肉落地式绿萝花盆架,ID：602832831544,¥ 60.90,2270,0,2019-09-10 18:05
https://detail.tmall.com/item.htm?id=602434701629,家用现代简约餐椅铁艺懒人时尚餐厅休闲靠背椅经济型北欧餐桌椅子,ID：602434701629,¥ 179.93,17803,1,2019-09-10 19:59
https://detail.tmall.com/item.htm?id=604587715156,钢木简易书架卧室置物架儿童书柜组合储物货架简约落地展示架收纳,ID:604587715156 编码:0831,¥ 115.50,7852,0,2019-09-28 17:31
https://detail.tmall.com/item.htm?id=603974792397,楠竹烤箱微波炉架厨房置物架餐边柜碗橱柜子实木多层收纳架储物柜,ID:603974792397 编码:储物柜置物架,¥ 346.50,10717,0,2019-09-29 18:04
https://detail.tmall.com/item.htm?id=604600621796,睡椅子 多功能 夏天陪病人睡床 折叠 单人户外躺椅防水防晒午休,ID：604600621796,¥ 274.68,9362,0,2019-10-03 16:17
https://detail.tmall.com/item.htm?id=602446040956,简易玄关鞋柜欧式鞋架简约现代创意门厅柜大容量阳台储物柜80长75,ID：602446040956,¥ 214.20,140696,1,2019-09-15 11:09
https://detail.tmall.com/item.htm?id=600706112759,创意时尚家用大号卫生间客厅厨房卧室办公室带压圈无盖垃圾桶纸篓,ID:600706112759 编码:7110,¥ 4.22,3499,59,2019-08-18 16:17
https://detail.tmall.com/item.htm?id=603096099157,电脑桌台式家用儿童小书桌书架组合简易办公写字台简约学生学习桌,ID：603096099157,¥ 176.40,5307,0,2019-09-15 11:06
https://detail.tmall.com/item.htm?id=602899734489,微波炉架落地调料架烤箱架家用多层厨房储物收纳置物架子碗架支架,ID：602899734489,¥ 294.84,63890,0,2019-09-15 11:11
https://detail.tmall.com/item.htm?id=602433861322,可移动床边桌升降写字台小茶几卧室床头桌子简约带轮边柜沙发边几,ID：602433861322,¥ 207.90,4855,1,2019-09-10 19:32
https://detail.tmall.com/item.htm?id=603339603920,网红置物架窄书柜简约学生办公室角落收纳柜家用卧室房间书架落地,ID：603339603920,¥ 352.80,5149,0,2019-09-18 17:07
https://detail.tmall.com/item.htm?id=594482556690,凳子网红 懒人 卧室折叠凳子便携式迷你金属矮马扎成人休闲户外钓,ID:594482556690 编码:00F34,¥ 12.32,4010,11,2019-05-19 11:22
https://detail.tmall.com/item.htm?id=606572619212,实用咖啡厅小学生教室书架书柜简易中学生落地教室用杂物摆设置物,ID:606572619212 编码:560732374679.35...,¥ 132.22,23556,0,2019-10-20 18:06
https://detail.tmall.com/item.htm?id=602837220163,实木简易床头柜40cm白色床边柜小型收纳柜子储物柜经济型藤编窄柜,ID：602837220163,¥ 263.76,1440,1,2019-09-20 14:19
https://detail.tmall.com/item.htm?id=602687320420,租房用的小桌子ins家用卧室简约现代笔记本台式电脑桌书桌写字桌,ID：602687320420,¥ 262.50,1524,0,2019-09-18 17:10
https://detail.tmall.com/item.htm?id=603983388594,梳妆台卧室现代简约书桌收纳柜一体化妆台欧式公主奢华化妆桌网红,ID：603983388594,¥ 190.00,5324,0,2019-09-29 21:42
https://detail.tmall.com/item.htm?id=602655351914,书架简易桌上置物架简约现代学生用宿舍小书柜儿童收纳办公书桌面,ID：602655351914,¥ 37.59,3450,2,2019-09-07 20:00
https://detail.tmall.com/item.htm?id=600826091778,北欧铁艺转角置物架落地客厅墙角书架三角形金色卧室靠墙角落收纳,ID：600826091778,¥ 862.40,8972,0,2019-08-10 22:22
https://detail.tmall.com/item.htm?id=600767330110,。小学生小孩桌儿童课桌椅写字密度板学习家用新款写作业的书桌桌,ID：600767330110,¥ 140.79,45816,0,2019-08-12 20:04
https://detail.tmall.com/item.htm?id=606577291244,鞋柜窄家用门口超薄翻斗带门简易多层小户型省空间玄关防尘木鞋架,ID:606577291244 编码:011,¥ 187.20,2035,0,2019-10-20 20:02
https://detail.tmall.com/item.htm?id=603340051111,拼装拐角电脑台式桌带书柜子一体桌组装1米转角弧形书桌书架组合,ID：603340051111,¥ 289.80,3404,1,2019-09-18 17:06
https://detail.tmall.com/item.htm?id=604650443410,鞋架白色多层鞋柜收纳柜防尘简易储物架家用经济型塑料组装鞋架子,ID：604650443410,¥ 94.50,9417,0,2019-09-29 20:34
https://detail.tmall.com/item.htm?id=602464814254,单人衣柜简易布衣柜出租房用组装实木牛津布艺柜子卧室折叠布柜小,ID：602464814254,¥ 73.50,47518,0,2019-09-07 20:43
https://detail.tmall.com/item.htm?id=603983992267,超薄翻斗式鞋柜门口大容量衣架一体带抽屉多功能省空间家用门厅柜,ID：603983992267,¥ 310.80,1412,0,2019-09-29 21:51
https://detail.tmall.com/item.htm?id=602428489323,电脑椅家用办公椅简约学生靠背座椅直播椅升降转椅电竞椅宿舍椅子,ID：602428489323,¥ 203.74,435724,0,2019-09-10 17:33
https://detail.tmall.com/item.htm?id=596270286172,客厅卧室机顶架置物架壁挂电视背景墙上柜隔板路由器收纳免打孔,ID：596270286172,¥ 66.58,95931,7,2019-06-06 16:07
https://detail.tmall.com/item.htm?id=592122353852,落地的50长方形橱房北欧茶杯柜储藏客厅厨房家用靠墙储物柜柜子,ID:592122353852 编码:5663,¥ 99.60,16224,1,2019-04-19 13:16
https://detail.tmall.com/item.htm?id=602931513089,穿鞋凳子门口家用结实耐用卧室客厅圆凳茶几矮凳子小板凳ins网红,ID：602931513089,¥ 100.80,2228,0,2019-09-18 18:02
https://detail.tmall.com/item.htm?id=604648567600,墙角置物架三角落地多层书架北欧客厅卧室转角柜子带抽屉收纳储物,ID：604648567600,¥ 226.80,39287,0,2019-09-29 19:55
https://detail.tmall.com/item.htm?id=591329856426,餐边柜茶柜茶水柜客厅简约现代实木制中式办公室收纳小型储物柜子,ID:591329856426 编码:00231j,¥ 830.06,596,0,2019-04-11 20:29
https://detail.tmall.com/item.htm?id=602836499871,实木转角书桌书架组合家用卧室学生台式电脑桌儿童学习桌简约写字,ID：602836499871,¥ 247.80,1683,1,2019-09-10 19:38
https://detail.tmall.com/item.htm?id=598510842859,实木质花架防腐木制落地室内植物架阳台客厅多肉摆放多层花盆架子,ID：598510842859,¥ 47.91,81390,1,2019-07-11 13:32
https://detail.tmall.com/item.htm?id=600368148580,钓鱼用的小凳子靠背椅折叠椅子外出坐椅老年人可收叠马札多功能凳,ID：600368148580,¥ 49.20,166800,1,2019-08-13 11:37
https://detail.tmall.com/item.htm?id=604650411483,儿童凳子靠背小椅子实木创意可爱卡通动物小鹿凳小板凳家用宝宝凳,ID：604650411483,¥ 83.79,8602,0,2019-09-29 20:35
https://detail.tmall.com/item.htm?id=602434757019,休闲躺椅床上靠背椅子大学生宿舍寝室电脑椅折叠椅懒人休闲椅靠椅,ID：602434757019,¥ 100.76,167728,1,2019-09-10 19:50
https://detail.tmall.com/item.htm?id=600566181901,鸟巢吊椅藤椅吊篮秋千配件钩弹簧挂钩消音器大号小号安全扣消声,ID：600566181901,¥ 16.99,19600,16,2019-08-12 20:04
https://detail.tmall.com/item.htm?id=602682380964,极简电视柜黑白简易置物架新款可伸缩家用现代简约轻奢地柜ins风,ID：602682380964,¥ 298.00,1668,2,2019-09-18 15:51
https://detail.tmall.com/item.htm?id=602642118623,落地桌上布简易学生用小型书架塑料置物架子收纳钢管组装桌书柜。,ID：602642118623,¥ 48.68,14263,9,2019-09-10 19:56
https://detail.tmall.com/item.htm?id=603970016121,北欧化妆椅子无靠背餐椅家用可叠螺堆叠简易实木凳子网红懒人便宜,ID：603970016121,¥ 178.50,324,0,2019-09-29 16:28
https://detail.tmall.com/item.htm?id=590929102219,打印机架子置物架落地复印桌子柜子放置收纳架放办公室工作台,ID:590929102219 编码:010,¥ 256.00,873,74,2019-04-03 11:53
https://detail.tmall.com/item.htm?id=606577931388,懒人沙发卧室电脑沙发椅喂奶椅宿舍折叠靠背躺椅小户型单人休闲椅,ID:606577931388 编码:M568,¥ 318.00,238468,0,2019-10-20 20:21
https://detail.tmall.com/item.htm?id=603980732723,电脑桌台式桌家用办公书桌简约现代卧室桌子学生写字桌简易小桌子,ID：603980732723,¥ 165.90,169749,0,2019-09-29 20:35
https://detail.tmall.com/item.htm?id=596923761909,液晶电视机增高架子显示器底座支架托架垫高电视柜电脑桌加高木架,ID：596923761909,¥ 72.00,15820,1,2019-06-20 19:46
https://detail.tmall.com/item.htm?id=602434913161,鞋架宿舍大学生床底寝室简易防尘迷你鞋柜鞋子收纳神器小型省空间,ID：602434913161,¥ 39.90,5558,15,2019-09-10 19:58
https://detail.tmall.com/item.htm?id=589620688692,衣柜简易布衣柜不锈钢方管加厚加粗螺丝组装折叠衣橱收纳大号包邮,ID:589620688692 编码:98/128/146/166/...,¥ 415.80,876,3,2019-03-24 12:09
https://detail.tmall.com/item.htm?id=604353824466,带伞孔夜市摆摊神器售楼部折叠桌拓客用品升降户外创业装备餐桌椅,ID：604353824466,¥ 115.39,57905,0,2019-10-03 16:22
https://detail.tmall.com/item.htm?id=589195702400,马凳折叠升降加厚特厚马镫装修便携马橙登多功能梯子铝合金脚手架,ID:589195702400 编码:MD-2015,¥ 149.60,112861,85,2019-03-15 20:36
https://detail.tmall.com/item.htm?id=604436698418,台式电脑桌子简约家用经济型卧室小户型学生省空间办公带抽屉桌子,ID：604436698418,¥ 185.98,19997,0,2019-09-29 17:59
https://detail.tmall.com/item.htm?id=604226461728,衣帽架北欧衣架落地卧室网红少女心欧式简约现代实木单杆式挂衣架,ID：604226461728,¥ 144.90,187067,0,2019-09-29 20:34
https://detail.tmall.com/item.htm?id=591233478944,床上衣柜女宿舍大学生寝室神器上铺下铺收纳小衣柜床头床尾置物架,ID:591233478944 编码:CSYG,¥ 71.60,192,9,2019-04-06 18:01
https://detail.tmall.com/item.htm?id=589728894647,免洗床小 两用可折叠变床 单双人多功能午休床懒人特价,ID：589728894647,¥ 696.00,7505,4,2019-03-21 17:34
https://detail.tmall.com/item.htm?id=602657279838,超大号2.3米全钢架简易衣柜钢架布衣柜钢管加厚简约现代组装衣柜,ID：602657279838,¥ 394.80,4479,1,2019-09-07 20:44
https://detail.tmall.com/item.htm?id=591122562570,式折叠矮阳光房小靠椅圆凳坐椅座阅读简约便捷乡村布椅子懒人椅,ID：591122562570,¥ 88.00,112454,9,2019-04-05 12:46
https://detail.tmall.com/item.htm?id=589034837619,儿童桌椅套装幼儿园塑料吃饭画画桌子可调节升降课桌宝宝学习家用,ID:589034837619 编码:KANGLONG,¥ 276.00,837,8,2019-03-15 16:36
https://detail.tmall.com/item.htm?id=600566617206,特大号放棉被子收纳柜易衣柜经济型钢架布衣柜组装衣服储物柜子,ID：600566617206,¥ 82.90,48650,5,2019-08-12 20:04
https://detail.tmall.com/item.htm?id=600333556057,小木凳可板凳木椅折叠马扎家用子矮靠背子实木制登子木质,ID：600333556057,¥ 17.92,24,10,2019-08-12 20:04
https://detail.tmall.com/item.htm?id=591468576331,实木写字桌子家用小圆桌方桌儿童宝宝学习桌玩具桌幼儿园桌游戏桌,ID:591468576331 编码:FS_306,¥ 663.26,2871,0,2019-04-13 15:58
https://detail.tmall.com/item.htm?id=589897563415,包邮多功能实木沙发推拉两用榻榻米简约现代组合小户型客厅书房床,ID:589897563415 编码:TTM2016,¥ 680.00,3636,4,2019-03-21 18:43
https://detail.tmall.com/item.htm?id=602190800918,鞋架简易宿舍收纳鞋架子 加厚多层布鞋柜 组装小鞋架经济,ID：602190800918,¥ 29.38,8688,6,2019-09-10 19:36
https://detail.tmall.com/item.htm?id=603096059106,鞋柜门厅柜鞋架阳台储物柜易经济型门口鞋柜长60cm高80cm仿实木,ID：603096059106,¥ 142.48,3960,0,2019-09-15 11:05
https://detail.tmall.com/item.htm?id=604229269758,可折叠床钢丝床单人折叠床1.2米家用1.5米双人床简易经济型铁床午,ID：604229269758,¥ 234.00,12676,0,2019-09-29 21:42
https://detail.tmall.com/item.htm?id=604226977101,实木衣架落地卧室简易衣架简约现代楠竹落地式挂衣架子衣帽架落地,ID：604226977101,¥ 220.50,8865,0,2019-09-29 20:34
https://detail.tmall.com/item.htm?id=606362710565,实木佛龛神龛佛柜神台供奉祖先观音菩萨财神关公二爷牌位墙壁挂,ID:606362710565 编码:009,¥ 340.08,12404,0,2019-10-20 19:20
https://detail.tmall.com/item.htm?id=600814647795,小床头柜迷你简约卧室25/30/35/40cm 小户型带锁白色超窄小床头柜,ID：600814647795,¥ 554.88,35005,0,2019-08-10 18:26
https://detail.tmall.com/item.htm?id=593652530047,儿童椅宝宝小椅子塑料靠背椅叫叫椅小板凳幼儿园小凳子带餐盘可选,ID:593652530047 编码:45554,¥ 99.60,23,3,2019-05-05 17:35
https://detail.tmall.com/item.htm?id=594658211530,简约现代全实木餐桌椅组合可伸缩折叠小户型家用4人客厅餐桌饭桌,ID:594658211530 编码:809,¥ 300.00,3457,0,2019-05-14 18:25
https://detail.tmall.com/item.htm?id=591829153557,电脑显示器增高架子垫高架抬高升高托架底座支架办公桌收纳文件架,ID:591829153557 编码:965,¥ 28.62,64158,21,2019-04-15 17:03
https://detail.tmall.com/item.htm?id=589124895702,抖音哄娃神器哄孩子哄睡婴儿摇摇椅懒人睡觉宝宝安抚带娃看娃躺椅,ID:589124895702 编码:f3334,¥ 99.98,10094,4,2019-03-12 23:26
https://detail.tmall.com/item.htm?id=594194074761,仿古实木书法桌书画桌中式家用绘画案写字台榆木书桌椅学生国学桌,ID:594194074761 编码:AJ-8888,¥ 364.00,217,2,2019-05-11 15:37
https://detail.tmall.com/item.htm?id=590084443579,懒人笔记本电脑桌床上用可移动书桌简易床边桌可倾斜沙发边桌茶几,ID:590084443579 编码:Q3,¥ 110.00,129,9,2019-03-23 17:07
https://detail.tmall.com/item.htm?id=589638780813,可折叠儿童床拼接床加宽床侧边床实木单人床加长带护栏定做小床,ID:589638780813 编码:AK-FG,¥ 258.00,981,8,2019-03-24 15:35
https://detail.tmall.com/item.htm?id=604226685479,简易衣柜布衣柜简约现代单人宿舍组装收纳柜子出租房布艺小挂衣橱,ID：604226685479,¥ 83.79,27801,0,2019-09-29 20:34
https://detail.tmall.com/item.htm?id=604601441698,写字椅可调节小学生椅子升降椅家用书桌凳铁艺靠背加固儿童学习椅,ID：604601441698,¥ 100.59,2459,0,2019-10-03 16:24
https://detail.tmall.com/item.htm?id=602765303152,塑料凳子双色光面高35cm成人家用会议餐桌椅浴室厕所防滑圆凳加厚,ID：602765303152,¥ 29.94,20695,36,2019-09-09 16:44
https://detail.tmall.com/item.htm?id=604445294883,乾宏家居不锈钢鞋架简易安装多层鞋柜多功能家用阳台置物架可定制,ID：604445294883,¥ 370.00,12853,0,2019-09-29 21:42
https://detail.tmall.com/item.htm?id=595312869634,家用简易塑料圆凳子高凳小椅子创意加厚成人矮凳板凳儿童宝宝脚凳,ID:595312869634 编码:8605,¥ 10.50,16877,18,2019-05-26 19:17
https://detail.tmall.com/item.htm?id=600165744154,衣柜简易布衣柜家用网红出租房用经济型实木加粗双人牛津布艺木质,ID：600165744154,¥ 236.00,13839,1,2019-08-10 11:19
https://detail.tmall.com/item.htm?id=602685872157,轻奢茶几收纳置物架配沙发网红设计师的简约阳台出租屋改造小家具,ID：602685872157,¥ 247.80,1120,1,2019-09-18 16:40
https://detail.tmall.com/item.htm?id=600760896731,粉色创意小马换鞋凳坐凳脚凳节日礼品沙发凳独角兽动物凳装饰摆件,ID：600760896731,¥ 770.40,19728,0,2019-08-19 14:20
https://detail.tmall.com/item.htm?id=604643887917,竹花架实木客厅室内简约绿萝花架单个花盆架阳台落地鱼缸置物架子,ID：604643887917,¥ 210.00,4342,0,2019-09-29 18:03
https://detail.tmall.com/item.htm?id=600996929877,便携式折叠小凳子折叠椅板凳钓鱼凳矮凳马扎户外写生坐火车四角凳,ID：600996929877,¥ 29.92,159308,3,2019-08-19 14:20
https://detail.tmall.com/item.htm?id=604354244608,现代家用成人懒人服装店沙发凳皮革网红更衣室小凳子衣帽间矮凳,ID：604354244608,¥ 95.82,20000,0,2019-10-03 16:30
https://detail.tmall.com/item.htm?id=602445908237,鞋柜家用省空间经济型简约门口厅卧室多层小鞋架防尘收纳置物柜子,ID：602445908237,¥ 201.60,31229,1,2019-09-15 10:55
https://detail.tmall.com/item.htm?id=602190712087,简约现代木质小茶几沙发边几角几方桌小户型客厅咖啡桌卧室床头柜,ID：602190712087,¥ 69.55,4951,2,2019-09-10 19:20
https://detail.tmall.com/item.htm?id=602687528887,入户玄关柜室外走廊过道多功能带门防尘大容量门口放鞋的鞋柜家用,ID：602687528887,¥ 627.90,2076,0,2019-09-18 17:18
https://detail.tmall.com/item.htm?id=603142406791,懒人笔记本电脑床桌客厅卧室床头床边桌可移动简约床上用的小桌子,ID：603142406791,¥ 157.50,2344,1,2019-09-18 17:19
https://detail.tmall.com/item.htm?id=604371438840,客厅电视柜加高款简约现代小户型电视机柜子北欧多功能地柜储物柜,ID：604371438840,¥ 243.60,7876,0,2019-09-28 14:37
https://detail.tmall.com/item.htm?id=600638270347,床头柜简约现代实木卧室收纳柜皮质床边小柜子储物窄柜简易置物架,ID：600638270347,¥ 316.00,10247,1,2019-08-10 22:20
https://detail.tmall.com/item.htm?id=588889857765,实木小凳子时尚创意沙发凳客厅椅子矮凳圆凳茶几凳布艺家用小板凳,ID：588889857765,¥ 27.80,6728,78,2019-03-13 19:38
https://detail.tmall.com/item.htm?id=588557610634,不锈钢餐边柜铝合金茶水柜厨房橱柜阳台储物柜收纳置物柜组装,ID：588557610634,¥ 380.00,895,5,2019-03-07 17:22
https://detail.tmall.com/item.htm?id=602424261176,折叠椅子凳子便携家用餐椅现代简约靠背椅时尚创意圆凳椅子电脑椅,ID：602424261176,¥ 61.74,182514,1,2019-09-10 16:11
https://detail.tmall.com/item.htm?id=589133645996,北欧进入门口外超薄翻斗斜插式小鞋柜窄款高简约玄关柜实木用,ID：589133645996,¥ 398.00,7024,3,2019-03-16 22:01
