https://detail.tmall.com/item.htm?id=600352704051,沙发床可折叠客厅小户型双人三人两用1.5 1.8米布艺沙发懒人沙发,ID：600352704051,¥ 212.00,13213,1,2019-08-13 04:03
https://detail.tmall.com/item.htm?id=603983616283,简约现代单门衣柜儿童窄小衣柜简易实木衣橱收纳柜 阳台柜 储物柜,ID：603983616283,¥ 336.00,21750,0,2019-09-29 21:42
https://detail.tmall.com/item.htm?id=604820058740,百搭非橡木北欧店面用圆形白色桌椅美容院圆桌椅茶楼小茶几园茶几,ID：604820058740,¥ 336.48,15388,0,2019-10-03 16:29
https://detail.tmall.com/item.htm?id=603141698052,简易床头柜简约现代卧室ins风格出租房专用收纳40cm宽床边小柜子,ID：603141698052,¥ 184.80,2274,0,2019-09-18 16:59
https://detail.tmall.com/item.htm?id=602184748676,洗衣机底座架子垫高不锈钢支架移动万向轮架子波轮全自动冰箱托架,ID：602184748676,¥ 83.79,1185,0,2019-09-10 17:20
https://detail.tmall.com/item.htm?id=600914715634,山东实木马扎子折叠凳椅子便携钓鱼画凳子槐木枣木户外靠背儿童小,ID：600914715634,¥ 25.80,4781,15,2019-08-12 10:12
https://detail.tmall.com/item.htm?id=600815211097,简易布衣柜收纳柜子组合经济型组装塑料租房挂卧室家用小布艺衣橱,ID：600815211097,¥ 198.00,6119,0,2019-08-10 18:25
https://detail.tmall.com/item.htm?id=604603265003,打孔吊挂阳台置物架壁挂墙上壁挂式杂物储物架墙柜书架床头装饰架,ID：604603265003,¥ 102.90,186116,0,2019-10-03 16:31
https://detail.tmall.com/item.htm?id=603095475315,包邮简易餐边柜碗柜厨柜三层组装柜不生锈铝合金柜橱柜厨房收纳柜,ID：603095475315,¥ 75.60,14978,0,2019-09-15 10:57
https://detail.tmall.com/item.htm?id=604355088146,办公电脑桌宿舍卧室书桌台式桌家用卧室没椅子单人小型简约经济型,ID：604355088146,¥ 161.78,81597,0,2019-10-03 16:31
https://detail.tmall.com/item.htm?id=603981016306,儿童学习桌小学生写字桌可升降书桌组合幼儿园家用小孩课桌椅套装,ID：603981016306,¥ 143.61,54361,0,2019-09-29 20:35
https://detail.tmall.com/item.htm?id=602693544389,全自动滚筒洗衣柜置物架落地ins创意空间收纳铁艺上方阳台洗衣柜,ID：602693544389,¥ 352.80,559,0,2019-09-18 19:08
https://detail.tmall.com/item.htm?id=604442882741,躺椅折叠午休睡便携沙滩季夏天凉爽家用休闲靠背懒人沙发折叠椅子,ID：604442882741,¥ 228.90,11273,0,2019-09-29 20:34
https://detail.tmall.com/item.htm?id=602657075969,实木茶几日式小圆桌子咖啡桌北欧小户型茶桌简约沙发边几圆形边桌,ID：602657075969,¥ 121.80,18932,0,2019-09-07 20:43
https://detail.tmall.com/item.htm?id=603981092203,简易衣柜单人小号衣橱宿舍挂衣柜经济型组装钢管布艺布衣柜收纳柜,ID：603981092203,¥ 66.99,8691,0,2019-09-29 20:35
https://detail.tmall.com/item.htm?id=603983788515,包邮书法桌电脑桌简易书桌书画桌办公桌培训桌课桌写字台简约定制,ID：603983788515,¥ 327.60,173192,0,2019-09-29 21:51
https://detail.tmall.com/item.htm?id=602834187622,伊姆斯椅时尚现代简约创意洽谈懒人北欧休闲靠背餐椅ins风书桌椅,ID：602834187622,¥ 87.78,46211,0,2019-09-10 18:35
https://detail.tmall.com/item.htm?id=603342243471,家用换鞋凳式反斗入门鞋柜门口可以坐的穿鞋凳经济型进门换鞋凳柜,ID：603342243471,¥ 304.50,813,2,2019-09-18 17:47
https://detail.tmall.com/item.htm?id=593923122301,平接床加宽拼接神器大床帮边床拼接床边增宽床扩展板简易儿童边榻,ID:593923122301 编码:34,¥ 419.20,9773,1,2019-05-08 17:07
https://detail.tmall.com/item.htm?id=600632806922,美式乡村实木小圆桌子欧式复古雕花咖啡桌阳台圆形拆装做旧茶几,ID：600632806922,¥ 780.00,6574,1,2019-08-10 20:36
https://detail.tmall.com/item.htm?id=602641010325,电视置物架显示器支架电视增高架电视柜电脑桌加高机顶盒搁架烤漆,ID：602641010325,¥ 69.83,19503,2,2019-09-10 19:22
https://detail.tmall.com/item.htm?id=602429517633,实木马扎便携式折叠凳子椅子红木马扎换鞋钓鱼板凳子送老人礼物,ID：602429517633,¥ 92.40,4027,1,2019-09-10 18:01
https://detail.tmall.com/item.htm?id=603347419462,异形书架落地多层收纳置物架经济型省空间个性简约儿童阅读小书柜,ID：603347419462,¥ 180.60,219799,1,2019-09-18 19:31
https://detail.tmall.com/item.htm?id=602186936184,花架仿实木多层绿萝塑料花盆架单个仿古客厅阳台室内落地置物架子,ID：602186936184,¥ 60.90,261545,1,2019-09-10 17:57
https://detail.tmall.com/item.htm?id=602434937156,现代简约塑料椅子北欧餐椅靠背椅家用创意餐桌椅咖啡厅休闲牛角椅,ID：602434937156,¥ 100.80,77592,56,2019-09-10 19:58
https://detail.tmall.com/item.htm?id=591707694194,滑移门小孩子小衣柜收纳柜男孩小型大衣橱木质实木衣柜小户型大柜,ID：591707694194,¥ 248.00,150059,1,2019-04-11 21:12
https://detail.tmall.com/item.htm?id=602180760945,梳妆凳现代简约化妆凳客厅坐凳换鞋凳卧室梳妆台凳子皮布艺美甲凳,ID：602180760945,¥ 73.08,6490,1,2019-09-10 16:11
https://detail.tmall.com/item.htm?id=602430229499,圆角亮光烤漆加厚搁板墙上一字隔板置物架装饰架书架壁挂架可定制,ID：602430229499,¥ 28.98,1003845,1,2019-09-10 18:16
https://detail.tmall.com/item.htm?id=602637010726,阳台花架子实木多层阶梯家用落地式铁艺室内客厅多肉植物花盆架子,ID：602637010726,¥ 46.20,62470,0,2019-09-10 17:58
https://detail.tmall.com/item.htm?id=602638250181,定做实木折叠拼接床加宽床加长床松木床架儿童单人床可定做床边床,ID：602638250181,¥ 168.00,16976,2,2019-09-10 18:15
https://detail.tmall.com/item.htm?id=602631890290,折叠桌餐桌家用小桌子吃饭桌简易小型折叠桌椅便携摆摊桌宿舍方桌,ID：602631890290,¥ 61.74,534474,1,2019-09-10 16:11
https://detail.tmall.com/item.htm?id=602188868315,书架简易桌上迷你学生用经济宿舍伸缩省空间实木办公室书桌收纳架,ID：602188868315,¥ 37.80,20038,2,2019-09-10 18:41
https://detail.tmall.com/item.htm?id=602432265576,雨伞架收纳家用酒店大堂商用雨伞桶进门口放置筒神器挂放伞的架子,ID：602432265576,¥ 102.90,16983,0,2019-09-10 18:59
https://detail.tmall.com/item.htm?id=604353732871,折叠床单人1.2米午休床便携式钢管办公室可移动家庭条纹儿童床,ID：604353732871,¥ 162.16,190800,0,2019-10-03 16:27
